{
  "schema_version": "0.1.1",
  "run_id": "8b3f5c4a-2e6d-4b0c-9a43-7d9e0a1b2c33",
  "run_kind": "controlled_public_benchmark",
  "condition": "intervention",
  "policy_id": "apl-policy-001-reread-avoidance",
  "policy_version": "1.0.0",
  "model": "claude-sonnet-5",
  "task_id": "apl-task-001-clean-file-reread",
  "pinned_commit": "4a7f2c9e1b8d3f05a6c2e9b7d4f10a3c5e8b6d29",
  "repo_url": "https://github.com/django/django",
  "disposition": "completed_not_activated",
  "disposition_reason": "Frozen task design offered no comparable re-read opportunity; retained in the record, excluded from the compliance comparison.",
  "model_evidence_consistent": true,
  "eligibility": {
    "activation_opportunity_present": false,
    "activation_observed": false
  },
  "created_at": "2026-08-19T11:30:00Z",
  "model_source": "declared_preflight"
}
