{
  "schema_version": "0.1.1",
  "run_id": "ad5b7e6c-4a8f-4d2e-9c65-9f1b2c3d4e55",
  "run_kind": "private_dogfood",
  "condition": "baseline",
  "policy_id": null,
  "policy_version": null,
  "model": "claude-sonnet-5",
  "task_id": "apl-task-001-clean-file-reread",
  "pinned_commit": "4a7f2c9e1b8d3f05a6c2e9b7d4f10a3c5e8b6d29",
  "repo_url": "local-private",
  "disposition": "completed_analyzable",
  "model_evidence_consistent": true,
  "created_at": "2026-08-19T13:00:00Z",
  "model_source": "declared_preflight"
}
