{
  "schema_version": "0.1.1",
  "run_id": "be6c8f7d-5b9a-4e3f-ad76-0a2c3d4e5f66",
  "run_kind": "private_dogfood",
  "condition": "baseline",
  "policy_id": null,
  "policy_version": null,
  "model": "claude-sonnet-5",
  "model_source": "observed_from_trace",
  "task_id": "apl-task-001-clean-file-reread",
  "pinned_commit": "4a7f2c9e1b8d3f05a6c2e9b7d4f10a3c5e8b6d29",
  "repo_url": "local-private",
  "disposition": "completed_analyzable",
  "model_evidence_consistent": true,
  "created_at": "2026-08-19T14:00:00Z"
}
